question_id,type,difficulty,topic,question,option_a,option_b,option_c,option_d,correct_option,
298,Global Finance,MCQ,Hard,Why do foreign exchange fluctuations affect multinational companies?,Only local rules matter,Changes in currency value impact profits,Inflation stops,Population growth,B,
299,Corporate Finance,MCQ,Hard,Why is monitoring debt levels important for firms?,To reduce default risk and interest cost,To increase taxes,To ignore shareholders,To increase spending,A,
300,Entrepreneurship,MCQ,Hard,What is the risk of launching a product without market testing?,Faster sales,Product failure,Better branding,Higher revenue,B,
301,Personal Finance,MCQ,Hard,Why is creating a monthly budget essential for individuals?,To spend more,To control money and plan expenses,To ignore bills,To reduce taxes,B,
302,Risk Management,MCQ,Hard,How does having insurance reduce financial risk?,Guarantees profits,Transfers risk to insurer,Stops inflation,Increases income,B,
303,Economic Systems,MCQ,Hard,Which economy relies on traditions for production and allocation?,Market economy,Command economy,Mixed economy,Traditional economy,D,
304,Interest,MCQ,Hard,How does reinvesting interest increase total returns?,Reduces returns,Increases returns due to compounding,Stops growth,Lowers inflation,B,
305,Loans & Credit,MCQ,Hard,Why is understanding loan terms important before borrowing?,To avoid hidden fees and high interest,To increase borrowing,To stop repayments,To reduce paperwork,A,
306,Banking Products,MCQ,Hard,Which banking product is suitable for short term safe deposits?,Current account,Savings account,Fixed deposit,Credit card,C,
307,Inflation,MCQ,Hard,How does high inflation affect fixed income earners?,Value increases,Real value declines,No effect,Value doubles,B,
308,Financial Technology,MCQ,Hard,How does digital payment technology improve financial transactions?,Slows payments,Makes payments faster and safer,Reduces spending,Stops inflation,B,
309,Stock Market,MCQ,Hard,Why is diversification important in stock investing?,Concentrates assets,Reduces risk across multiple stocks,Guarantees profit,Avoids taxes,B,
310,Entrepreneurship,MCQ,Hard,What is the risk of launching a business without market research?,Faster sales,Product failure,Customer loyalty,Increased profits,B,
311,Personal Finance,MCQ,Hard,Why is tracking monthly income and expenses important?,To spend more,To manage money and avoid debt,To ignore bills,To reduce taxes,B,
312,Risk Management,MCQ,Hard,How does an emergency fund reduce financial risk?,Guarantees profit,Covers unexpected expenses without debt,Stops inflation,Increases income,B,
313,Economic Systems,MCQ,Hard,Which system allows both private ownership and government regulation?,Command economy,Mixed economy,Market economy,Traditional economy,B,
314,Interest,MCQ,Hard,How does compound interest grow faster over longer durations?,Principal reduces,Interest reinvestment increases total,Rate decreases,Inflation drops,B,
315,Loans & Credit,MCQ,Hard,Why is paying only minimum credit card dues risky?,Lowers total interest,Total interest increases significantly,Loan closes faster,Improves credit score,B,
316,Banking Products,MCQ,Hard,Which account allows limited withdrawals with interest earning?,Savings account,Current account,Fixed deposit,Credit card,C,
317,Inflation,MCQ,Hard,If prices rise faster than income what happens to purchasing power?,Increases,Declines,No change,Doubles,B,
318,Financial Technology,MCQ,Hard,How do digital wallets make transactions safer?,Sharing passwords,Using encrypted systems and authentication,Ignoring alerts,Using weak networks,B,
319,Stock Market,MCQ,Hard,Why should investors monitor company financial reports?,To ignore market,To make informed investment decisions,To stop compounding,To reduce taxes,B,
320,Entrepreneurship,MCQ,Hard,What is the risk of scaling a business too fast without planning?,Higher profits,Operational failure,Stronger brand,Faster expansion,B,
321,Personal Finance,MCQ,Hard,Why is building an emergency fund essential?,To increase spending,To cover unexpected expenses,To reduce income,To avoid saving,B,
322,Risk Management,MCQ,Hard,How does diversification reduce portfolio risk?,Concentrates assets,Spreads investments across sectors,Stops interest,Reduces taxes,B,
323,Economic Systems,MCQ,Hard,Which system relies mainly on market forces?,Command economy,Market economy,Mixed economy,Traditional economy,B,
324,Interest,MCQ,Hard,Why does starting investment early increase wealth?,Rate decreases,Time allows interest to compound multiple times,Principal reduces,Inflation drops,B,
325,Loans & Credit,MCQ,Hard,What happens if someone borrows more than they can repay?,Lowers interest,Debt accumulation and stress,Guarantees profits,No effect,B,
326,Banking Products,MCQ,Hard,Which product is suitable for saving small amounts regularly?,Current account,Recurring deposit,Fixed deposit,Credit card,B,
327,Inflation,MCQ,Hard,How does persistent high inflation affect savers?,Value of savings increases,Real value declines,No effect,Doubles,B,
328,Financial Technology,MCQ,Hard,Why is online banking considered convenient?,It requires physical presence,Transactions can be done anytime and anywhere,Only cash transactions allowed,It slows payments,B,
329,Stock Market,MCQ,Hard,Why is investing in multiple sectors recommended?,Concentrates risk,Reduces sector-specific risk,Guarantees profit,Stops inflation,B,
330,Entrepreneurship,MCQ,Hard,What is the main danger of launching a business without a budget?,Higher revenue,Running out of cash,Strong brand,Faster market entry,B,
331,Personal Finance,MCQ,Hard,Why is monitoring monthly expenses important?,To spend more,To identify wasteful spending,To ignore bills,To reduce taxes,B,
332,Risk Management,MCQ,Hard,How does having insurance reduce financial uncertainty?,Guarantees profit,Transfers risk to insurer,Stops inflation,Increases income,B,
333,Economic Systems,MCQ,Hard,Which system relies mainly on government for economic decisions?,Market economy,Command economy,Mixed economy,Traditional economy,B,
334,Interest,MCQ,Hard,How does reinvesting interest increase total returns?,Reduces returns,Increases returns through compounding,Stops growth,Lowers inflation,B,
335,Loans & Credit,MCQ,Hard,Why should loan interest rates be compared before borrowing?,To reduce total repayment,To increase borrowing,To stop repayments,To reduce paperwork,A,
336,Banking Products,MCQ,Hard,Which account provides safe storage with regular interest?,Current account,Savings account,Fixed deposit,Credit card,B,
337,Inflation,MCQ,Hard,What happens if inflation rises faster than wages?,Purchasing power increases,Declines,No change,Doubles,B,
338,Financial Technology,MCQ,Hard,How do fintech apps improve financial management?,Slow payments,Track expenses and payments easily,Require cash only,Increase paperwork,B,
339,Stock Market,MCQ,Hard,Why is understanding company fundamentals important for investors?,To ignore market,To make informed decisions,To stop compounding,To reduce taxes,B,
340,Entrepreneurship,MCQ,Hard,What is the risk of expanding a business without planning resources?,Higher profits,Operational failure,Strong brand,Faster expansion,B,
341,Personal Finance,MCQ,Hard,Why should young adults save a portion of income regularly?,To increase spending,To build financial security,To ignore budgeting,To reduce income,B,
342,Risk Management,MCQ,Hard,How does diversification reduce investment risk?,Concentrates assets,Spreads investments across sectors,Stops interest,Reduces taxes,B,
343,Economic Systems,MCQ,Hard,Which economy relies mostly on private ownership and free markets?,Command economy,Market economy,Mixed economy,Traditional economy,B,
344,Interest,MCQ,Hard,Why does starting investment early help grow wealth faster?,Principal reduces,Time allows interest to compound multiple times,Rate decreases,Inflation drops,B,
345,Loans & Credit,MCQ,Hard,What is the danger of borrowing more than can be repaid?,Lowers interest,Debt accumulation and stress,Guarantees profit,No effect,B,
346,Banking Products,MCQ,Hard,Which account is best for recurring monthly savings?,Current account,Recurring deposit,Fixed deposit,Credit card,B,
347,Inflation,MCQ,Hard,How does persistent inflation affect money saved in banks?,Value increases,Real value declines,No effect,Doubles,B,
348,Financial Technology,MCQ,Hard,Why is mobile banking considered secure?,Requires cash,Uses encryption and authentication,No verification,Slows transactions,B,
349,Stock Market,MCQ,Hard,Why is it important to diversify stock investments?,Concentrates risk,Reduces sector-specific risk,Guarantees profit,Stops inflation,B,
350,Entrepreneurship,MCQ,Hard,What is the risk of starting multiple products without resources?,Faster market entry,Poor execution and failure,Better branding,Higher revenue,B,
351,Personal Finance,MCQ,Hard,Why is setting aside a monthly saving portion important?,To spend more,To build financial security,To ignore budgeting,To reduce income,B,
352,Risk Management,MCQ,Hard,How does insurance protect against unexpected financial losses?,Guarantees profits,Transfers risk to insurer,Stops inflation,Increases daily income,B,
353,Interest,MCQ,Hard,How does compound interest benefit long term investments?,Principal reduces,Interest reinvestment grows wealth,Rate decreases,Inflation drops,B,
354,Loans & Credit,MCQ,Hard,Why is reading loan terms carefully crucial?,To avoid hidden fees and high interest,To increase borrowing,To stop repayments,To reduce paperwork,A,
355,Inflation,MCQ,Hard,What happens if inflation rises faster than income?,Purchasing power increases,Declines,No change,Doubles,B,
356,Financial Technology,MCQ,Hard,How do digital payment systems reduce transaction risk?,Slows payments,Secure authentication and tracking,Increases errors,Requires cash only,B,
357,Stock Market,MCQ,Hard,Why should investors diversify across sectors?,Concentrates risk,Reduces sector-specific risk,Guarantees profit,Stops inflation,B,
358,Entrepreneurship,MCQ,Hard,What is the main risk of expanding business too fast?,Higher revenue,Operational and cash flow failures,Strong brand,Faster market entry,B,
359,Personal Finance,MCQ,Hard,Why is tracking monthly income and expenses critical?,To spend more,To manage money and avoid debt,To ignore bills,To reduce taxes,B,
360,Risk Management,MCQ,Hard,How does risk transfer reduce financial exposure?,By ignoring losses,Using insurance or hedging,Increasing spending,Avoiding planning,B,
361,Retirement Planning,MCQ,Hard,Why should individuals start retirement planning early?,To spend all money,To accumulate funds for future,To ignore savings,To reduce taxes,B,
362,Bonds,MCQ,Hard,What is the main benefit of investing in government bonds?,High risk,Fixed returns and safety,Unlimited returns,Stop inflation,B,
363,Interest,MCQ,Hard,Why does reinvesting interest increase wealth over time?,Reduces returns,Compounding grows total returns,Stops growth,Lowers inflation,B,
364,Loans & Credit,MCQ,Hard,What is the risk of taking multiple loans simultaneously?,Debt accumulation and stress,Lower interest,Faster repayment,No effect,A,
365,Inflation,MCQ,Hard,How does persistent inflation affect savings in bank accounts?,Value increases,Real value declines,No effect,Doubles,B,
366,Financial Technology,MCQ,Hard,Why is mobile banking considered convenient?,Requires physical presence,Transactions can be done anytime and anywhere,Only cash transactions allowed,Slows payments,B,
367,Stock Market,MCQ,Hard,Why is monitoring stock performance important for investors?,To ignore market,To make informed decisions,To stop compounding,To reduce taxes,B,
368,Entrepreneurship,MCQ,Hard,What is the risk of launching multiple products without resources?,Faster market entry,Resource strain and poor execution,Better branding,Higher revenue,B,
369,Retirement Planning,MCQ,Hard,How does starting retirement savings early benefit an individual?,Lower interest,More time for compounding growth,Reduces taxes,Avoids expenses,B,
370,Bonds,MCQ,Hard,Why are corporate bonds riskier than government bonds?,Guaranteed return,Higher default risk,No risk,Stop inflation,B,
371,Personal Finance,MCQ,Hard,Why should individuals set financial goals?,To spend more,To plan savings and investments,To ignore budgeting,To reduce income,B,
372,Risk Management,MCQ,Hard,How does insurance reduce financial exposure?,Guarantees profits,Transfers risk to insurer,Stops inflation,Increases income,B,
373,Interest,MCQ,Hard,How does starting investment early increase compound interest benefits?,Rate decreases,Time allows interest to compound multiple times,Principal reduces,Inflation drops,B,
374,Loans & Credit,MCQ,Hard,Why is paying only minimum credit card dues risky?,Lowers total interest,Total interest increases significantly,Loan closes faster,Improves credit score,B,
375,Inflation,MCQ,Hard,How does high inflation affect purchasing power?,Increases,Declines,No change,Doubles,B,
376,Financial Technology,MCQ,Hard,How do fintech apps improve financial tracking?,Slow payments,Allow easy monitoring of spending,Require cash only,Increase paperwork,B,
377,Stock Market,MCQ,Hard,Why is it important to diversify stock holdings?,Concentrates risk,Reduces sector-specific risk,Guarantees profit,Stops inflation,B,
378,Entrepreneurship,MCQ,Hard,What is the risk of expanding a business without planning?,Higher revenue,Operational failure,Strong brand,Faster market entry,B,
379,Personal Finance,MCQ,Hard,Why is an emergency fund important?,To increase spending,To cover unexpected expenses,To reduce income,To avoid saving,B,
380,Risk Management,MCQ,Hard,How does diversification protect investments?,Concentrates assets,Spreads investments across sectors,Stops interest,Reduces taxes,B,
381,Retirement Planning,MCQ,Hard,Why should retirement savings start early?,To spend all money,To accumulate funds for future,To ignore savings,To reduce taxes,B,
382,Bonds,MCQ,Hard,Why are government bonds considered safe?,High risk,Fixed returns and safety,Unlimited returns,Stop inflation,B,
383,Interest,MCQ,Hard,Why does reinvesting interest increase wealth over time?,Reduces returns,Compounding grows total returns,Stops growth,Lowers inflation,B,
384,Loans & Credit,MCQ,Hard,What happens if someone borrows more than they can repay?,Lowers interest,Debt accumulation and stress,Guarantees profit,No effect,B,
385,Inflation,MCQ,Hard,How does persistent inflation affect bank savings?,Value increases,Real value declines,No effect,Doubles,B,
386,Financial Technology,MCQ,Hard,Why is online banking considered secure?,Requires cash,Uses encryption and authentication,No verification,Slows transactions,B,
387,Stock Market,MCQ,Hard,Why should investors monitor company financial reports?,To ignore market,To make informed decisions,To stop compounding,To reduce taxes,B,
388,Entrepreneurship,MCQ,Hard,What is the risk of launching multiple products at once?,Faster market entry,Resource strain and poor execution,Better branding,Higher revenue,B,
389,Retirement Planning,MCQ,Hard,How does starting retirement contributions early benefit an individual?,Lower interest,More time for compounding,Reduces taxes,Avoids expenses,B,
390,Bonds,MCQ,Hard,Why are corporate bonds riskier than government bonds?,Guaranteed return,Higher default risk,No risk,Stop inflation,B,
391,Personal Finance,MCQ,Hard,Why should young adults track spending habits?,To spend more,To improve financial management,To ignore budgeting,To reduce income,B,
392,Risk Management,MCQ,Hard,How does risk assessment improve financial decisions?,Guarantees profit,Helps identify and mitigate risks,Stops inflation,Increases daily income,B,
393,Interest,MCQ,Hard,How does compounding affect long term investments?,Reduces returns,Grows wealth faster,Rate decreases,Inflation drops,B,
394,Loans & Credit,MCQ,Hard,Why is it important to read all loan terms?,To avoid hidden fees and high interest,To increase borrowing,To stop repayments,To reduce paperwork,A,
395,Inflation,MCQ,Hard,How does high inflation affect savers?,Value increases,Value declines,No effect,Doubles,B,
396,Financial Technology,MCQ,Hard,How do digital wallets enhance payment security?,Sharing passwords,Using encrypted authentication,Ignoring alerts,Using weak networks,B,
397,Stock Market,MCQ,Hard,Why is analyzing market trends important for investors?,To ignore market,To make informed investment decisions,To stop compounding,To reduce taxes,B,
398,Entrepreneurship,MCQ,Hard,What is the risk of launching a business without capital planning?,Higher revenue,Running out of funds,Strong brand,Faster market entry,B,
399,Retirement Planning,MCQ,Hard,Why should retirement plans be reviewed regularly?,To increase spending,To adjust contributions and investments,To ignore savings,To reduce taxes,B,
400,Bonds,MCQ,Hard,Why should investors consider bond ratings before investing?,High risk is best,Ratings indicate credit quality and default risk,No risk,Stop inflation,B,
401,Risk Management,MCQ,Hard,How does insurance protect against unexpected financial losses?,Guarantees profits,Transfers risk to insurer,Stops inflation,Increases income,B,
402,Interest,MCQ,Hard,How does compound interest benefit long term investments?,Principal reduces,Interest reinvestment grows wealth,Rate decreases,Inflation drops,B,
403,Inflation,MCQ,Hard,How does persistent inflation affect bank savings?,Value increases,Real value declines,No effect,Doubles,B,
404,Financial Technology,MCQ,Hard,How do fintech apps improve financial management?,Slow payments,Track expenses and payments easily,Require cash only,Increase paperwork,B,
405,Stock Market,MCQ,Hard,Why should investors diversify across sectors?,Concentrates risk,Reduces sector-specific risk,Guarantees profit,Stops inflation,B,
406,Entrepreneurship,MCQ,Hard,What is the risk of expanding a business too fast without planning?,Higher revenue,Operational failure,Strong brand,Faster market entry,B,
407,Retirement Planning,MCQ,Hard,Why should retirement savings start early?,To spend all money,To accumulate funds for future,To ignore savings,To reduce taxes,B,
408,Bonds,MCQ,Hard,Why are corporate bonds riskier than government bonds?,Guaranteed return,Higher default risk,No risk,Stop inflation,B,
409,Risk Management,MCQ,Hard,How does diversification reduce investment risk?,Concentrates assets,Spreads investments across sectors,Stops interest,Reduces taxes,B,
410,Interest,MCQ,Hard,Why does reinvesting interest increase total returns?,Reduces returns,Compounding grows total returns,Stops growth,Lowers inflation,B,
411,Inflation,MCQ,Hard,How does high inflation affect purchasing power?,Increases,Declines,No change,Doubles,B,
412,Financial Technology,MCQ,Hard,Why is online banking considered secure?,Requires cash,Uses encryption and authentication,No verification,Slows transactions,B,
413,Stock Market,MCQ,Hard,Why is monitoring stock performance important?,To ignore market,To make informed decisions,To stop compounding,To reduce taxes,B,
414,Entrepreneurship,MCQ,Hard,What is the risk of launching multiple products at once?,Faster market entry,Resource strain and poor execution,Better branding,Higher revenue,B,
415,Retirement Planning,MCQ,Hard,How does starting retirement contributions early benefit an individual?,Lower interest,More time for compounding,Reduces taxes,Avoids expenses,B,
416,Bonds,MCQ,Hard,What is the main benefit of investing in government bonds?,High risk,Fixed returns and safety,Unlimited returns,Stop inflation,B,
417,Taxation,MCQ,Hard,Why is understanding tax rules important for individuals?,To avoid legal issues,To ignore payments,To reduce spending,To stop earning,A,
418,Credit Scores,MCQ,Hard,How does timely repayment of loans affect credit score?,Decreases score,Improves score,No effect,Stops growth,B,
419,Taxation,MCQ,Hard,What is the impact of not paying taxes on time?,Penalties and interest,Rewards,Increases income,Stops inflation,A,
420,Credit Scores,MCQ,Hard,Why is maintaining a good credit score important?,Easier borrowing at lower rates,Reduces income,Stops savings,Guarantees profits,A,
421,Risk Management,MCQ,Hard,How does insurance reduce financial uncertainty?,Guarantees profits,Transfers risk to insurer,Stops inflation,Increases income,B,
422,Interest,MCQ,Hard,How does starting investment early affect compound interest?,Rate decreases,Time allows interest to compound multiple times,Principal reduces,Inflation drops,B,
423,Inflation,MCQ,Hard,How does high inflation impact savings?,Value increases,Real value declines,No effect,Doubles,B,
424,Financial Technology,MCQ,Hard,How do fintech apps help track expenses?,Slow payments,Easy monitoring of spending,Require cash only,Increase paperwork,B,
425,Stock Market,MCQ,Hard,Why should investors diversify their portfolio?,Concentrates risk,Reduces sector-specific risk,Guarantees profit,Stops inflation,B,
426,Entrepreneurship,MCQ,Hard,What is the risk of expanding a business without planning resources?,Higher profits,Operational failure,Strong brand,Faster market entry,B,
427,Retirement Planning,MCQ,Hard,Why is early retirement saving important?,To spend all money,To accumulate funds for future,To ignore savings,To reduce taxes,B,
428,Bonds,MCQ,Hard,Why are corporate bonds riskier than government bonds?,Guaranteed return,Higher default risk,No risk,Stop inflation,B,
429,Taxation,MCQ,Hard,Why should individuals understand income tax laws?,To avoid penalties,To ignore payments,To increase spending,To stop earning,A,
430,Credit Scores,MCQ,Hard,How does timely repayment of debts affect credit score?,Decreases score,Improves score,No effect,Stops growth,B,
431,Risk Management,MCQ,Hard,How does risk assessment improve financial decisions?,Guarantees profit,Helps identify and mitigate risks,Stops inflation,Increases income,B,
432,Interest,MCQ,Hard,How does reinvesting interest help grow wealth?,Reduces returns,Compounding grows total returns,Stops growth,Lowers inflation,B,
433,Inflation,MCQ,Hard,How does inflation affect purchasing power if income is fixed?,Increases,Declines,No change,Doubles,B,
434,Financial Technology,MCQ,Hard,Why is mobile banking considered convenient?,Requires physical presence,Transactions can be done anytime,Only cash transactions allowed,Slows payments,B,
435,Stock Market,MCQ,Hard,Why is analyzing company fundamentals important?,To ignore market,To make informed decisions,To stop compounding,To reduce taxes,B,
436,Entrepreneurship,MCQ,Hard,What is the risk of launching a business without capital planning?,Higher revenue,Running out of funds,Strong brand,Faster market entry,B,
437,Retirement Planning,MCQ,Hard,How does starting retirement savings early benefit an individual?,Lower interest,More time for compounding,Reduces taxes,Avoids expenses,B,
438,Bonds,MCQ,Hard,What is the main advantage of investing in government bonds?,High risk,Fixed returns and safety,Unlimited returns,Stop inflation,B,
439,Taxation,MCQ,Hard,What is the consequence of not filing taxes on time?,Penalties and interest,Rewards,Increases income,Stops inflation,A,
440,Credit Scores,MCQ,Hard,Why is maintaining a good credit score important?,Easier borrowing at lower rates,Reduces income,Stops savings,Guarantees profits,A,
441,Risk Management,MCQ,Hard,How does diversification reduce financial risk?,Concentrates assets,Spreads investments,Stops interest,Reduces taxes,B,
442,Interest,MCQ,Hard,Why does starting investment early help grow wealth faster?,Principal reduces,Time allows interest to compound multiple times,Rate decreases,Inflation drops,B,
443,Inflation,MCQ,Hard,How does persistent inflation affect money saved in banks?,Value increases,Real value declines,No effect,Doubles,B,
444,Financial Technology,MCQ,Hard,How do digital wallets enhance payment security?,Sharing passwords,Using encrypted authentication,Ignoring alerts,Using weak networks,B,
445,Stock Market,MCQ,Hard,Why is it important to diversify stock investments?,Concentrates risk,Reduces sector-specific risk,Guarantees profit,Stops inflation,B,
446,Entrepreneurship,MCQ,Hard,What is the risk of expanding a business too fast?,Higher profits,Operational failure,Strong brand,Faster market entry,B,
447,Retirement Planning,MCQ,Hard,Why should retirement plans be reviewed regularly?,To increase spending,To adjust contributions and investments,To ignore savings,To reduce taxes,B,
448,Bonds,MCQ,Hard,Why should investors consider bond ratings before investing?,High risk is best,Ratings indicate credit quality,No risk,Stop inflation,B,
449,Taxation,MCQ,Hard,How can tax planning benefit individuals?,Avoid legal compliance,Optimize savings and reduce liabilities,Increase debt,Stop earning,B,
450,Credit Scores,MCQ,Hard,How does borrowing responsibly affect credit score?,Decreases score,Improves score,No effect,Stops growth,B,
451,Risk Management,MCQ,Hard,How does insurance reduce financial uncertainty?,Guarantees profits,Transfers risk to insurer,Stops inflation,Increases income,B,
452,Interest,MCQ,Hard,How does compound interest benefit long term investments?,Principal reduces,Interest reinvestment grows wealth,Rate decreases,Inflation drops,B,
453,Inflation,MCQ,Hard,How does persistent inflation affect savings?,Value increases,Real value declines,No effect,Doubles,B,
454,Financial Technology,MCQ,Hard,How do fintech apps help manage finances?,Slow payments,Track spending and payments easily,Require cash only,Increase paperwork,B,
455,Stock Market,MCQ,Hard,Why is diversifying stocks across sectors important?,Concentrates risk,Reduces sector-specific risk,Guarantees profit,Stops inflation,B,
456,Entrepreneurship,MCQ,Hard,What is the risk of expanding a business too fast without planning?,Higher revenue,Operational failure,Strong brand,Faster market entry,B,
