question_id,type,difficulty,topic,question,option_a,option_b,option_c,option_d,correct_option,
1,Saving & Spending,MCQ,Hard,A student receives 10000 as a one-time scholarship and expects no income for the next 3 months. Which option best balances spending and saving?,Spend most now and save later,Save the entire amount,Allocate money monthly for essentials and save the rest,Spend on non-essentials while prices are low,C,
2,Budgeting,MCQ,Hard,A monthly budget shows expenses always exceeding income even after cutting wants. What is the most logical next step?,Ignore the budget,Use credit cards regularly,Increase income or reduce fixed costs,Stop tracking expenses,C,
3,Banking,True/False,Medium,Keeping large amounts of money idle in a savings account for many years may reduce its real value due to inflation.,TRUE,FALSE,,,A,
4,Digital Payments,MCQ,Hard,A user receives a UPI collect request from an unknown person marked as refund. What is the safest action?,Approve to check details,Reject and report the request,Ask sender for OTP,Pay a small amount first,B,
5,Interest,MCQ,Hard,Two banks offer 10% annual interest: Bank A uses simple interest Bank B uses compound interest annually. After 3 years which statement is correct?,Both give same amount,Bank A gives more,Bank B gives more,Cannot be compared,C,
6,Loans & Credit,True/False,Medium,Even a low-interest loan can become expensive if the repayment period is very long.,TRUE,FALSE,,,A,
7,Insurance,MCQ,Medium,Why is health insurance more critical than life insurance for a teenager with dependent parents?,Premiums are cheaper,Medical emergencies are unpredictable,It gives higher returns,It replaces savings,B,
8,Investment,MCQ,Hard,Which factor most strongly affects long-term investment returns?,Daily price changes,Timing the market perfectly,Staying invested over time,Investing large amounts at once,C,
9,Inflation,True/False,Hard,If inflation is 6% and your savings grow at 5% your real wealth increases.,TRUE,FALSE,,,B,
10,Frauds & Financial Safety,MCQ,Hard,Which situation shows a phishing attempt rather than a genuine bank communication?,Asking to visit branch with ID,Email asking for login details via link,SMS about failed transaction,App notification after payment,B,
11,Saving & Spending,MCQ,Hard,A student has fixed expenses for food and travel every month and limited income. Which action best improves financial stability over time?,Reduce savings to spend more,Track expenses and cut unnecessary costs,Borrow small amounts regularly,Ignore small daily expenses,B,
12,Budgeting,MCQ,Hard,A budget shows higher spending during exam months due to coaching fees. What is the smartest adjustment?,Remove savings permanently,Increase budget only for that period,Stop tracking budget,Take a loan every exam month,B,
13,Banking,MCQ,Medium,Why is keeping money in multiple bank accounts sometimes useful?,It always increases interest,It reduces all risks completely,It helps manage risk and access,Banks require it by law,C,
14,Digital Payments,True or False,Medium,Using the same password for multiple payment apps increases security risk?,TRUE,FALSE,,,A,
15,Interest,MCQ,Hard,If interest is compounded annually then the interest earned each year increases because?,Principal reduces,Interest adds to previous interest,Rate changes automatically,Time becomes shorter,B,
16,Loans & Credit,MCQ,Hard,A person pays only the minimum amount due on a credit bill each month. What is the most likely result?,Loan ends faster,Total interest paid increases,Credit score improves instantly,Repayment time decreases,B,
17,Insurance,True or False,Medium,Insurance is most useful for events that are rare but cause high financial loss?,TRUE,FALSE,,,A,
18,Investment,MCQ,Hard,An investor chooses to diversify investments. What is the main reason?,To guarantee profit,To reduce overall risk,To avoid taxes,To increase short term gains,B,
19,Inflation,MCQ,Hard,If prices rise faster than income over many years what happens to standard of living?,It improves,It remains same,It decreases,It becomes unpredictable,C,
20,Frauds & Financial Safety,MCQ,Hard,Which action best protects against online financial fraud?,Sharing details with friends,Ignoring app updates,Verifying sources before clicking,Responding quickly to unknown calls,C,
21,Saving & Spending,MCQ,Hard,A student saves money every month but often withdraws it for wants. What is the biggest long term problem with this habit?,Lower bank balance,No interest earned,Failure to build real savings,Increased spending power,C,
22,Budgeting,MCQ,Hard,A person follows a budget but ignores irregular expenses like repairs. What is the most likely outcome?,Budget always balances,Sudden financial stress,Higher savings,Better planning accuracy,B,
23,Banking,True or False,Medium,Keeping money in a bank account is safer than storing large cash amounts at home?,TRUE,FALSE,,,A,
24,Digital Payments,MCQ,Hard,A payment app shows a failed transaction but money is debited. What is the best first action?,Panic and repay,Contact bank or app support,Share details online,Ignore the issue,B,
25,Interest,MCQ,Hard,Two investments have the same rate and time but one compounds annually and the other quarterly. Which gives higher returns?,Annual compounding,Quarterly compounding,Both same,Cannot be determined,B,
26,Loans & Credit,MCQ,Hard,Why is taking multiple small loans at the same time risky?,Easier repayment,Lower interest,Higher combined repayment burden,Better credit score,C,
27,Insurance,MCQ,Medium,Why do people pay insurance premiums regularly even if they may not claim?,To earn interest,To avoid saving,For financial protection,To increase income,C,
28,Investment,True or False,Hard,Investing only in one asset type increases financial risk?,TRUE,FALSE,,,A,
29,Inflation,MCQ,Hard,If income remains constant while inflation rises steadily what happens over time?,Purchasing power increases,Purchasing power stays same,Purchasing power decreases,Wealth doubles,C,
30,Frauds & Financial Safety,MCQ,Hard,A message promises reward money for clicking a link. What should be done first?,Click quickly,Share with friends,Verify from official source,Reply to sender,C,
31,Saving & Spending,MCQ,Hard,A student increases income but spending rises at the same rate. What happens to savings over time?,Savings increase,Savings stay same,Savings do not improve,Savings double,C,
32,Budgeting,MCQ,Hard,A budget is reviewed only once a year. What is the biggest risk of this approach?,Less paperwork,Missed spending issues,Higher savings,Better control,B,
33,Banking,MCQ,Medium,Why is maintaining a minimum bank balance important?,To earn rewards,To avoid penalties,To increase interest rate,To get loans faster,B,
34,Digital Payments,True or False,Hard,Approving a collect request on a payment app always means receiving money?,TRUE,FALSE,,,B,
35,Interest,MCQ,Hard,An investment earns compound interest. Why does time matter more than rate in long term growth?,Rate stays fixed,Growth accelerates over time,Interest stops later,Principal reduces,B,
36,Loans & Credit,MCQ,Hard,What is the main danger of delaying loan repayments frequently?,Lower monthly cost,Reduced stress,Increased total interest,Faster loan closure,C,
37,Insurance,MCQ,Medium,Why should insurance coverage be reviewed periodically?,To cancel policy,To match changing needs,To avoid claims,To reduce paperwork,B,
38,Investment,MCQ,Hard,An investor reacts emotionally to market falls and sells quickly. What is the likely result?,Higher long term returns,Reduced risk,Poor investment outcomes,Guaranteed profit,C,
39,Inflation,True or False,Hard,If inflation stays low then long term savings planning is unnecessary?,TRUE,FALSE,,,B,
40,Frauds & Financial Safety,MCQ,Hard,A call claims urgent account verification is needed. What is the safest response?,Share details quickly,Hang up and contact bank,Follow instructions,Transfer small amount,B,
41,Saving & Spending,MCQ,Hard,A student saves regularly but uses savings for impulse purchases. What is the main long term impact?,Better flexibility,Loss of financial discipline,Higher interest,Faster goal achievement,B,
42,Budgeting,MCQ,Hard,Why should emergency expenses be included while planning a budget?,They never occur,They reduce income,They prevent sudden financial pressure,They increase spending,C,
43,Banking,True or False,Medium,Bank deposits are generally safer than keeping large cash at home?,TRUE,FALSE,,,A,
44,Digital Payments,MCQ,Hard,A user enters payment details on a fake website. What risk is highest?,Slower payment,Data theft,App crash,Payment delay,B,
45,Interest,MCQ,Hard,Why does compound interest benefit long term savers more than short term savers?,Interest rate is higher,Time increases growth effect,Principal stays constant,Interest stops later,B,
46,Loans & Credit,MCQ,Hard,A borrower frequently misses due dates but pays later. What is the likely effect?,Lower interest,No impact,Credit score damage,Loan cancellation,C,
47,Insurance,True or False,Medium,Insurance helps transfer financial risk from individual to insurer?,TRUE,FALSE,,,A,
48,Investment,MCQ,Hard,Why is long term investing usually preferred over frequent trading?,Less paperwork,Lower emotional decisions,Guaranteed profits,No risk,B,
49,Inflation,MCQ,Hard,If inflation rises faster than savings growth what happens to future purchasing power?,It increases,It stays same,It decreases,It doubles,C,
50,Frauds & Financial Safety,MCQ,Hard,A message claims prize money and asks for bank details. What should be done?,Reply immediately,Share details,Delete and report,Forward to friends,C,
51,Saving & Spending,MCQ,Hard,A student increases savings rate but income remains fixed. What must change to sustain this habit long term?,Borrow money,Reduce unnecessary spending,Stop saving later,Increase wants,B,
52,Budgeting,MCQ,Hard,A budget ignores future goals like college fees. What is the biggest risk?,Short term comfort,Poor long term planning,Higher income,Lower expenses,B,
53,Digital Payments,True or False,Medium,Entering payment details on unsecured websites increases financial risk?,TRUE,FALSE,,,A,
54,Interest,MCQ,Hard,If compounding frequency increases while rate stays same what happens to final amount?,It decreases,It remains same,It increases,It becomes zero,C,
55,Loans & Credit,MCQ,Hard,A borrower takes a new loan to repay an old one repeatedly. What is this situation called?,Smart refinancing,Debt trap,Credit building,Asset creation,B,
56,Investment,MCQ,Hard,Why does starting investments early give advantage even with small amounts?,Higher risk,More time for compounding,Guaranteed returns,Lower inflation,B,
57,Inflation,True or False,Hard,Inflation affects savers more than spenders in the long term?,TRUE,FALSE,,,A,
58,Frauds & Financial Safety,MCQ,Hard,A fraud message creates urgency and fear. Why is this effective?,It offers rewards,It reduces logical thinking,It increases trust,It improves security,B,
59,Taxation,MCQ,Medium,Why should individuals understand basic income tax rules early?,To avoid earning,To plan finances better,To stop saving,To increase spending,B,
60,Entrepreneurship,MCQ,Hard,A student starts a small business without studying demand. What is the biggest risk?,High profit,Business failure,Faster growth,Low effort,B,
61,Saving & Spending,MCQ,Hard,A student plans to save for a laptop in one year. What is the most effective first step?,Buy accessories now,Estimate total cost and monthly saving,Borrow from friends,Wait for discounts only,B,
62,Budgeting,MCQ,Hard,A budget shows surplus every month but savings remain low. What is the most likely reason?,Income is low,Savings not allocated deliberately,Expenses are fixed,Inflation is zero,B,
63,Digital Payments,MCQ,Medium,Why should payment app notifications be reviewed regularly?,To reduce phone storage,To track errors or fraud,To increase rewards,To speed payments,B,
64,Interest,True or False,Hard,Higher compounding frequency always leads to higher total interest when rate and time are same?,TRUE,FALSE,,,A,
65,Loans & Credit,MCQ,Hard,What happens if credit is used for regular consumption instead of emergencies?,Wealth increases,Financial stress increases,Savings grow,Risk disappears,B,
66,Investment,MCQ,Hard,An investor ignores inflation while planning returns. What is the main mistake?,Overestimating real growth,Reducing risk,Increasing liquidity,Shortening time,A,
67,Inflation,MCQ,Hard,If inflation averages six percent annually what happens to money value over long periods?,It grows faster,It stays constant,It erodes steadily,It becomes irrelevant,C,
68,Frauds & Financial Safety,True or False,Medium,Scammers often use official looking messages to gain trust?,TRUE,FALSE,,,A,
69,Taxation,MCQ,Hard,Why can delaying tax planning increase financial burden later?,Lower income,Missed exemptions,Higher savings,Reduced paperwork,B,
70,Entrepreneurship,MCQ,Hard,A student business prices products without calculating costs. What is the biggest danger?,Faster sales,Operating at a loss,Brand growth,Customer loyalty,B,
71,Saving & Spending,MCQ,Hard,A student increases income through freelancing but lifestyle expenses also rise. What concept explains this problem?,Forced saving,Lifestyle inflation,Budget surplus,Passive income,B,
72,Budgeting,MCQ,Hard,Why should long term goals be broken into monthly budget targets?,To reduce effort,To make goals achievable,To avoid saving,To increase spending,B,
73,Digital Payments,True or False,Medium,Saving card details on unsecured websites increases fraud risk?,TRUE,FALSE,,,A,
74,Interest,MCQ,Hard,An investment doubles faster due to compounding. What factor mainly causes this effect?,Higher tax,Time and reinvestment,Fixed principal,Lower rate,B,
75,Loans & Credit,MCQ,Hard,Why is credit card interest usually higher than loan interest?,Shorter tenure,Unsecured nature,Government rules,Higher limits,B,
76,Investment,MCQ,Hard,An investor chooses safety only and ignores growth. What risk does this create over time?,Market loss,Inflation risk,Liquidity risk,Default risk,B,
77,Inflation,True or False,Hard,Inflation impacts future expenses more than present expenses?,TRUE,FALSE,,,A,
78,Frauds & Financial Safety,MCQ,Hard,A scam message avoids giving verifiable contact details. Why is this a warning sign?,It saves time,It prevents verification,It increases trust,It is legal,B,
79,Taxation,MCQ,Hard,Why does higher income without tax planning reduce net savings?,More spending,Higher tax outflow,Lower income,Fewer goals,B,
80,Entrepreneurship,MCQ,Hard,A student business grows sales but profits remain low. What is the most likely issue?,Weak demand,Poor cost control,High marketing,Low effort,B,
81,Saving & Spending,MCQ,Hard,A student receives a bonus and spends it immediately. What principle is being ignored?,Emergency planning,Delayed gratification,Passive income,Budget review,B,
82,Budgeting,MCQ,Hard,Why should budgets be adjusted when income changes?,To increase work,To maintain financial balance,To stop saving,To raise expenses,B,
83,Digital Payments,MCQ,Medium,Why should payment app permissions be checked regularly?,To save battery,To limit data misuse,To speed transactions,To increase rewards,B,
84,Interest,True or False,Hard,Compound interest benefits early investors more than late investors?,TRUE,FALSE,,,A,
85,Loans & Credit,MCQ,Hard,What happens when loan tenure is increased without changing rate?,EMI increases,Total interest increases,Loan ends early,Risk disappears,B,
86,Investment,MCQ,Hard,Ignoring asset allocation in investing leads to what problem?,Guaranteed loss,Unbalanced risk exposure,Faster growth,Higher liquidity,B,
87,Inflation,MCQ,Hard,If inflation stays higher than returns for many years what is the result?,Wealth grows,Wealth remains same,Wealth declines,Wealth doubles,C,
88,Frauds & Financial Safety,True or False,Medium,Fraud attempts often create urgency to force quick decisions?,TRUE,FALSE,,,A,
89,Taxation,MCQ,Hard,Why is tax saving planning usually done before financial year ends?,To earn interest,To reduce taxable income legally,To avoid income,To increase expenses,B,
90,Entrepreneurship,MCQ,Hard,A business grows revenue but cash flow remains weak. What is the main issue?,Low demand,Poor cash management,High profit,Strong pricing,B,
91,Saving & Spending,MCQ,Hard,A student prioritizes wants over needs regularly. What is the most likely long term outcome?,Faster happiness,Financial instability,Higher savings,Better control,B,
92,Budgeting,MCQ,Hard,Why should fixed expenses be reviewed periodically in a budget?,They never change,Income may change,To increase spending,To remove savings,B,
93,Digital Payments,True or False,Medium,Using biometric authentication improves payment security?,TRUE,FALSE,,,A,
94,Interest,MCQ,Hard,An investment grows slowly at first then faster later. What explains this pattern?,Simple interest,Compounding effect,Rate reduction,Inflation drop,B,
95,Loans & Credit,MCQ,Hard,Why is missing even one loan payment risky?,EMI increases,Credit score impact,Loan ends early,Interest stops,B,
96,Investment,MCQ,Hard,Investing without a clear goal usually leads to what problem?,Guaranteed loss,Poor decision making,Higher returns,Faster growth,B,
97,Inflation,True or False,Hard,Rising inflation makes future financial planning more important?,TRUE,FALSE,,,A,
98,Frauds & Financial Safety,MCQ,Hard,A fraud call asks for secrecy and urgency. Why is this dangerous?,It saves time,It blocks verification,It increases rewards,It lowers risk,B,
99,Taxation,MCQ,Hard,Why does higher tax slab reduce take home income growth?,Lower salary,Higher deductions,Higher tax rate,Reduced savings,C,
100,Entrepreneurship,MCQ,Hard,A startup focuses only on sales and ignores costs. What is the biggest risk?,Fast growth,Profit loss,Strong branding,Customer trust,B,
101,Financial Planning,MCQ,Hard,Why is setting clear financial goals important for long term planning?,It increases income,It guides financial decisions,It removes risk,It guarantees returns,B,
102,Risk Management,MCQ,Hard,What is the main purpose of managing financial risk?,To avoid earning,To reduce possible losses,To increase spending,To remove planning,B,
103,Digital Payments,True or False,Medium,Using public devices for online payments increases security risk?,TRUE,FALSE,,,A,
104,Interest,MCQ,Hard,Why does compounding reward patience more than frequent withdrawals?,Rate increases,Money stays invested longer,Tax reduces,Inflation stops,B,
105,Loans & Credit,MCQ,Hard,Taking credit without repayment planning leads to what outcome?,Faster growth,Debt accumulation,Higher savings,Lower stress,B,
106,Investment,MCQ,Hard,Why should investment choices match financial goals?,To avoid income,To align risk and time,To reduce returns,To stop compounding,B,
107,Inflation,True or False,Hard,Inflation makes future expenses harder to predict?,TRUE,FALSE,,,A,
108,Frauds & Financial Safety,MCQ,Hard,A fraud scheme promises guaranteed returns. Why is this a warning sign?,Returns are fast,Guarantees are unrealistic,It is legal,It is insured,B,
109,Taxation,MCQ,Hard,Why does ignoring tax planning reduce effective returns?,Higher income,Missed deductions,Lower expenses,Faster refunds,B,
110,Entrepreneurship,MCQ,Hard,A business expands rapidly without systems. What risk increases most?,Brand value,Operational failure,Customer demand,Profit margin,B,
111,Financial Planning,MCQ,Hard,Why should emergency funds be part of a financial plan?,To increase income,To handle unexpected expenses,To avoid investing,To reduce taxes,B,
112,Risk Management,MCQ,Hard,Which action best reduces financial risk over time?,Spending more,Diversifying income sources,Ignoring losses,Avoiding planning,B,
113,Digital Payments,MCQ,Medium,Why should transaction histories be checked regularly?,To save data,To detect errors or fraud,To increase rewards,To slow spending,B,
114,Interest,True or False,Hard,Longer investment duration increases the power of compounding?,TRUE,FALSE,,,A,
115,Loans & Credit,MCQ,Hard,What is the biggest risk of delaying loan repayments repeatedly?,Lower EMI,Higher total interest,Faster closure,No effect,B,
116,Investment,MCQ,Hard,Why is matching risk level to time horizon important in investing?,To increase tax,To reduce volatility impact,To avoid saving,To stop growth,B,
117,Inflation,MCQ,Hard,If inflation rises unexpectedly what is the immediate effect on savings?,Value increases,Value decreases,No change,Value doubles,B,
118,Frauds & Financial Safety,True or False,Medium,Genuine financial institutions ask for confidential details over calls?,TRUE,FALSE,,,B,
119,Taxation,MCQ,Hard,Why can delayed tax filing create financial issues?,Faster refunds,Penalties and interest,Higher income,Lower tax,B,
120,Entrepreneurship,MCQ,Hard,A business owner ignores cash reserves during growth. What risk increases?,Brand loyalty,Cash shortage,Market share,Profit margin,B,
121,Financial Planning,MCQ,Hard,Why is reviewing a financial plan regularly important?,To track progress,To increase spending,To ignore goals,To reduce savings,A,
122,Risk Management,MCQ,Hard,What is the effect of concentrating all investments in one asset?,Lower risk,Higher risk,Guaranteed returns,Better liquidity,B,
123,Digital Payments,MCQ,Medium,Why is two factor authentication recommended for payment apps?,Faster transactions,Extra security layer,Lower fees,To increase rewards,B,
124,Interest,MCQ,Hard,Which factor makes compound interest more effective than simple interest over long term?,Rate alone,Time and reinvestment,Principal reduces,Tax benefits,B,
125,Loans & Credit,MCQ,Hard,Using credit for non essential expenses regularly can cause what?,Lower stress,Debt accumulation,Faster repayment,Higher credit score,B,
126,Investment,True or False,Hard,Diversifying investments helps in reducing total risk?,TRUE,FALSE,,,A,
127,Inflation,MCQ,Hard,What happens to purchasing power if income growth is lower than inflation?,Increases,Stays same,Decreases,Doubles,C,
128,Frauds & Financial Safety,MCQ,Hard,Which action reduces risk of online payment fraud?,Ignoring updates,Using verified apps only,Sharing OTP with friends,Clicking all links quickly,B,
129,Taxation,MCQ,Hard,Why is planning deductions important for salaried individuals?,To avoid paying taxes illegally,To reduce taxable income legally,To increase salary,To delay payments,B,
130,Entrepreneurship,MCQ,Hard,What is the main risk of launching a product without market research?,Higher sales,Product failure,Increased profits,Better branding,B,
131,Financial Planning,MCQ,Hard,Why should short term and long term goals be planned separately?,To reduce effort,To prioritize resources effectively,To avoid investing,To increase spending,B,
132,Risk Management,MCQ,Hard,What is the main benefit of insurance in personal finance?,Reduces future financial loss,Increases daily income,Avoids budgeting,Guarantees profit,A,
133,Digital Payments,MCQ,Medium,Why is it important to update payment apps regularly?,Faster payments,To fix security vulnerabilities,To increase cashback,To reduce bank charges,B,
134,Interest,MCQ,Hard,How does reinvesting earned interest affect total returns?,Reduces returns,Increases returns due to compounding,No effect,Stops growth,B,
135,Loans & Credit,MCQ,Hard,What is the main risk of taking a loan without reading terms carefully?,Lower interest,Hidden charges and penalties,Faster repayment,Higher credit score,B,
136,Investment,MCQ,Hard,Why is long term investing usually less risky than short term speculation?,Time reduces market volatility impact,Tax is lower,Returns are fixed,Investment stops,A,
137,Inflation,True or False,Hard,Inflation reduces the value of money over time?,TRUE,FALSE,,,A,
138,Frauds & Financial Safety,MCQ,Hard,Which behaviour increases risk of online scams?,Verifying sources,Sharing personal details with unknown contacts,Using official apps,Logging out after use,B,
139,Taxation,MCQ,Hard,Why should individuals keep proof of investments and expenses for tax purposes?,To reduce taxable income legally,To avoid savings,To increase spending,To ignore taxes,A,
140,Entrepreneurship,MCQ,Hard,What is the risk of starting a business without a clear revenue model?,Higher customer satisfaction,Business may fail financially,Faster growth,Lower risk,B,
141,Financial Planning,MCQ,Hard,Why is it important to plan for retirement early?,To increase short term spending,To ensure sufficient funds later,To avoid taxes,To reduce work hours,B,
142,Risk Management,MCQ,Hard,How does diversification reduce investment risk?,By concentrating assets,By spreading investments across different assets,By avoiding taxes,By ignoring market trends,B,
143,Digital Payments,MCQ,Medium,Why is avoiding public Wi-Fi important while making payments?,Faster transactions,Reduces risk of data theft,More rewards,Better tracking,B,
144,Interest,MCQ,Hard,Which factor increases the effect of compound interest the most?,Short duration,Frequent reinvestment of interest,Low principal,Fixed rate,B,
145,Loans & Credit,MCQ,Hard,Why is paying only minimum credit card dues risky?,Interest stops,Total interest increases significantly,Credit score improves,Loan closes faster,B,
146,Investment,MCQ,Hard,What is the main reason for matching investment type to financial goal?,To increase paperwork,To align risk and returns,To stop inflation,To reduce principal,B,
147,Inflation,MCQ,Hard,What happens if expenses grow faster than income over years?,Purchasing power increases,Purchasing power declines,Income grows automatically,Expenses stay constant,B,
148,Frauds & Financial Safety,MCQ,Hard,Why should unknown links in messages not be clicked?,Faster browsing,May lead to fraud or malware,Reduces bank balance,Improves rewards,B,
